00:38:35.560,00:38:36.870,早说太后也要出席,00:38:35.340,00:38:36.320,"Let's go, My Lady."
00:38:37.200,00:38:38.190,连十七爷都回来了,00:38:36.320,00:38:38.080,I heard that the Empress Dowager will also be attending.
00:38:38.760,00:38:39.950,咱们若迟了可不好,00:38:38.240,00:38:40.000,Even Lord XVII has returned.
00:38:40.520,00:38:41.230,走吧,00:38:40.000,00:38:42.000,It'd be impolite to be late.
,,,00:38:42.000,00:38:43.140,Let's go.
00:38:42.360,00:38:44.910,儿臣此行去了剑阁梓潼的古栈道,00:38:43.380,00:38:45.940,"Your Majesty, in this trip, I went to the
ancient plank road from Jiange to Zitong,"
00:38:45.280,00:38:46.390,李冰的都江堰,,,
00:38:46.680,00:38:48.470,还有杜甫的浣花居所,00:38:45.940,00:38:47.660,and to Dujiangyan [an ancient irrigation system].
00:38:49.600,00:38:51.270,千佛岩可看了吗,00:38:47.660,00:38:50.300,I also visited Du Fu's thatched cottage by the Huanhua Creek.
00:38:51.680,00:38:53.550,儿臣知道皇额娘心念佛事,00:38:50.760,00:38:52.580,Did you visit the Thousand-Buddha Cliff?
00:38:53.920,00:38:55.350,已经替皇额娘一一拜过,00:38:52.720,00:38:54.800,I know Your Majesty is devoted to the Buddha
00:38:56.480,00:38:58.150,难为你一片孝心,00:38:54.940,00:38:57.320,so I worshipped them one by one on your behalf.
,,,00:38:57.500,00:38:59.820,I appreciate your filial piety.
00:38:59.200,00:39:01.750,蜀道难于上青天,00:39:00.000,00:39:02.520,"""The road to Shu is harder than climbing to the sky.""
[from a poem by Li Bai.]"
00:39:02.120,00:39:03.550,你此行辛苦了,00:39:03.000,00:39:05.120,It must be a difficult trip for you.
00:39:07.720,00:39:09.590,华妃这件衣裳不借,00:39:08.640,00:39:11.080,"Consort Fleur is beautifully dressed today,"
00:39:10.360,00:39:12.070,哀家虽然眼神不好,00:39:11.240,00:39:13.360,"Even though I have a poor eyesight,"
00:39:12.640,00:39:14.750,都觉着光彩夺目,00:39:13.480,00:39:15.920,I can see how dazzling it is.
00:39:17.440,00:39:19.030,太后赏了那支步摇,,,
00:39:19.400,00:39:21.230,臣妾想着得有些好衣裳配,00:39:18.560,00:39:23.260,"I thought I must complement the step swing
Your Majesty awarded me with beautiful clothes."
00:39:21.640,00:39:22.510,才相得益彰,,,
00:39:23.000,00:39:25.350,所以让绣院新做了几身,00:39:23.800,00:39:26.420,So I ordered some from the Embroidery Department.
00:39:25.920,00:39:28.150,什么衣裳得配什么首饰,00:39:26.700,00:39:29.420,Good jewellery must go with good clothes.
00:39:28.520,00:39:31.270,本宫看华妃簪的绢花,,,
00:39:31.800,00:39:33.270,也价值不菲呀,00:39:29.480,00:39:34.260,"That silk flower you're wearing, I can tell, is also priceless."
00:39:33.760,00:39:36.470,宫中簪发的绢花都是绸缎做的,00:39:34.480,00:39:37.620,The flower hairpins in the palace are all made of fabric.
00:39:37.000,00:39:39.470,虽然好看却容易腐坏,00:39:38.060,00:39:40.860,They look pretty but are easy to spoil.
00:39:39.920,00:39:42.350,臣妾用的是金线密织,00:39:41.040,00:39:43.560,Mine is densely woven with gold thread
00:39:42.760,00:39:44.470,穿宝石珠子做的,00:39:43.560,00:39:45.500,and studded with jewels and pearls.
00:39:45.320,00:39:48.870,的确好看 但是花费也不小吧,00:39:46.500,00:39:50.460,It definitely looks nice. But it must have cost a lot.
00:39:51.000,00:39:52.510,多谢皇后关怀,00:39:51.000,00:39:53.720,I thank Your Majesty for your concern.
00:39:52.960,00:39:54.990,臣妾家里好歹有些贴补,00:39:54.000,00:39:56.180,"After all, my family subsidizes me."
00:39:55.400,00:39:56.710,不必费宫中的钱,00:39:56.260,00:39:58.660,I need not use the palace's money.
00:39:58.800,00:40:01.950,都像华妃一样有个好娘家才好呢,00:39:59.680,00:40:03.160,If only everyone had a family like Consort Fleur's!
00:40:02.480,00:40:04.390,就不用守着月例银子,,,
00:40:04.720,00:40:05.870,过得紧巴巴的,00:40:03.320,00:40:07.500,There'd be no need for frugality over the tight monthly stipends.
00:40:08.440,00:40:10.030,臣妾娘家再好,,,
00:40:10.480,00:40:12.110,也是得皇上赏识,00:40:09.500,00:40:13.280,My family would be nothing without His Majesty's appreciation.
00:40:12.960,00:40:14.830,年羹尧就你这么一个妹妹,00:40:13.580,00:40:15.980,You're Nian Gengyao's only sister.
00:40:15.120,00:40:17.030,自然是朕赏赐他什么,,,
00:40:17.400,00:40:18.470,他都贴补给你了,00:40:16.000,00:40:20.060,He would surely pass on anything I rewarded to you.
00:40:21.720,00:40:24.350,太后 您服药的时间到了,00:40:22.640,00:40:25.440,"Your Majesty, it's time for medicine."
00:40:24.680,00:40:26.470,太医还在宫中等着呢,00:40:25.500,00:40:27.820,The imperial doctor is waiting for you.
00:40:27.600,00:40:28.390,皇帝,,,
00:40:28.840,00:40:31.830,哀家觉得不太舒服就先回去了,00:40:28.660,00:40:32.700,I'm not feeling very well. I have to leave now.
00:40:32.040,00:40:33.510,皇额娘要保重身子,,,
00:40:33.800,00:40:34.950,儿子才能放心,00:40:32.980,00:40:34.740,"Take care of yourself, Mother."
,,,00:40:34.860,00:40:36.860,Then I can put my mind at ease.
00:40:41.880,00:40:43.950,恭送太后,00:40:42.920,00:40:45.320,I bid Your Majesty goodbye.
00:40:48.160,00:40:50.430,这是莞贵人新酿的美酒,00:40:49.240,00:40:51.480,This is the wine that Lady Sourire brewed.
00:40:50.720,00:40:51.710,大家一同尝尝,,,
00:40:52.800,00:40:54.230,这是桂花酒,00:40:51.500,00:40:53.740,Let's all have a taste of it.
00:40:57.200,00:40:59.310,朕与莞贵人一同采摘,00:40:53.880,00:40:56.300,This one is osmanthus wine.
00:40:59.560,00:41:02.350,今秋新开的桂花酿成此酒,00:40:58.180,00:41:03.280,"This autumn, Lady Sourire and I picked some
osmanthus flowers to make this wine."
00:41:03.680,00:41:05.190,难怪皇兄这般得意,00:41:04.500,00:41:06.500,No wonder Your Majesty was so proud
00:41:05.600,00:41:07.030,让我们大家都尝一尝,00:41:06.780,00:41:08.760,when you asked us to try it.
00:41:08.040,00:41:10.590,家宴之上众位王爷在座,00:41:09.000,00:41:11.840,"In an imperial feast with so much royalty present,"
00:41:11.160,00:41:14.510,桂花酒甜醉 但却略显简薄,00:41:12.000,00:41:15.480,the osmanthus wine is sweet but seems unremarkable.
00:41:15.320,00:41:17.910,若是以宫中珍藏的美酒待客,,,
00:41:18.240,00:41:19.830,岂不更显天家风范,00:41:16.380,00:41:21.220,"Wouldn't the imperial hospitality manifest better if the
guests are served with the treasured wine in the palace?"
00:41:20.840,00:41:22.190,西北战事初平,,,
00:41:22.520,00:41:24.630,自太后皇上起都节俭用度,00:41:21.740,00:41:23.780,The war in the northwest has just been quelled.
00:41:24.880,00:41:27.030,后宫理当与太后皇上共进退,00:41:23.840,00:41:25.840,"Since Their Majesties are very frugal,"
00:41:28.080,00:41:29.910,以皇上亲手所制的桂花酒,00:41:25.840,00:41:28.520,there is no reason that the harem should differ.
00:41:30.240,00:41:32.310,代替名贵酒种遍示亲贵,00:41:29.120,00:41:33.320,"We replaced the precious wine with
the osmanthus wine His Majesty brewed."
00:41:32.760,00:41:35.150,不仅是皇上节俭用度之心,00:41:33.820,00:41:36.200,"This not only shows His Majesty's virtues of thrift,"
00:41:35.360,00:41:37.310,更显皇室亲密无间,00:41:36.200,00:41:38.300,but also brings the extended family closer.
00:41:38.480,00:41:41.510,莞贵人提倡节俭那自然是很好的,00:41:39.480,00:41:42.600,"There's nothing wrong with advocating thrift, Lady Sourire."
00:41:42.080,00:41:42.510,可是早闻,,,
00:41:42.760,00:41:45.510,贵人有一双蜀锦绣成的玉鞋,00:41:43.000,00:41:46.540,"But I heard that you have a pair of
jade shoes made with Shu Brocade."
00:41:45.880,00:41:46.910,奢华无比,,,
00:41:47.200,00:41:48.310,不知道姐姐我,00:41:46.760,00:41:48.120,That is so luxurious.
00:41:48.600,00:41:50.350,是否有幸可以一观呢,00:41:48.300,00:41:52.060,I wonder if I would have the honor to admire them.
00:41:52.520,00:41:55.110,那是皇上喜欢莞姐姐才赐给她的,00:41:53.500,00:41:56.320,His Majesty adores Sourire and awarded her the shoes.
00:41:55.560,00:41:57.910,自然是越贵重越奢华越好喽,00:41:56.500,00:41:59.320,That is why they are expensive and luxurious.
00:41:58.240,00:42:00.350,既然皇上喜欢又有什么不可以呢,00:41:59.320,00:42:01.920,"There is nothing wrong with His Majesty's adoration,"
00:42:00.800,00:42:02.150,皇上您说是不是,00:42:01.920,00:42:03.820,"is there, Your Majesty?"
00:42:04.120,00:42:07.350,朕最喜欢 你有什么便说什么,00:42:05.000,00:42:08.820,I appreciate your frankness the best.
00:42:09.480,00:42:11.710,富察贵人你说是不是,00:42:10.460,00:42:13.040,"What do you think, Lady Fuca?"
00:42:13.640,00:42:15.390,淳常在说得不借,00:42:14.660,00:42:16.920,"You are right, Attendant Chun."
00:42:23.000,00:42:36.000,"Translators: The Magpie Bridge Brigade 鹊桥小队翻译组
Subscription: liberapay.com/ZHZSubbers
Twitter/FB/IG @BrigadeMagpie 公众号/微博: 鹊桥小队翻译组",00:42:23.000,00:42:36.000,"[contact translators] carsenwei@yahoo.com
[subtitles subscription] liberapay.com/ZHZSubbers"
00:42:36.000,00:42:39.000,"Theme: The Lonely Phoenix
[phoenix is the symbol of an empress]",00:42:36.000,00:42:39.000,"Theme: The Lonely Phoenix
[phoenix is the symbol of an empress]"
00:42:41.000,00:42:59.000,"I dimly recall the colorful blooms in every summer.
They are as distant as the autumn moon in the water.",00:42:41.000,00:42:59.000,"I dimly recall the colorful blooms in every summer.
They are as distant as the autumn moon in the water."
00:42:59.000,00:43:19.000,"He loved me with a volatile heart.
And before I knew it, we fell apart.",00:42:59.000,00:43:19.000,"He loved me with a volatile heart.
And before I knew it, we fell apart."
00:43:19.000,00:43:36.000,"Behind me are the promises and longing.
Before me lie the flute and the zither.",00:43:19.000,00:43:36.000,"Behind me are the promises and longing.
Before me lie the flute and the zither."
00:43:36.000,00:43:54.000,"I loved you with my body and soul
But you hurt me from head to toe.",00:43:36.000,00:43:54.000,"I loved you with my body and soul
But you hurt me from head to toe."
00:43:54.000,00:44:02.000,"My wish ran athwart
and I ended up a fool of my destiny.",00:43:54.000,00:44:02.000,"My wish ran athwart
and I ended up a fool of my destiny."
00:44:02.000,00:44:14.000,My love was the wind-swept flowers from a tree.,00:44:02.000,00:44:14.000,My love was the wind-swept flowers from a tree.
00:44:14.000,00:44:33.000,"A plum bloomed in winter hoping for a fruitful summer.
But the irresistible winds of destiny destroyed her wish.",00:44:14.000,00:44:33.000,"A plum bloomed in winter hoping for a fruitful summer.
But the irresistible winds of destiny destroyed her wish."
00:44:33.000,00:44:41.000,"You can hear the flapping of a phoenix
but you will never see it.",00:44:33.000,00:44:41.000,"You can hear the flapping of a phoenix
but you will never see it."
00:44:41.000,00:44:47.600,What you see is the falling leaves from the phoenix tree.,00:44:41.000,00:44:47.600,What you see is the falling leaves from the phoenix tree.
00:44:51.000,00:45:04.000,The falling leaves from the phoenix tree.,,,
